{
    "$schema": "../../schemas/amenity.schema.json",
    "id": "055-amenity-family-friendly-playground",
    "slug": "playground",
    "description": {
        "es": "Parque infantil",
        "en": "Parque infantil",
        "pt": "Parque infantil"
    },
    "applicableVerticals": ["accommodation"],
    "type": "FAMILY_FRIENDLY",
    "icon": "PlaygroundIcon",
    "isBuiltin": false,
    "isFeatured": true,
    "displayWeight": 55
}
