{
    "$schema": "../../schemas/amenity.schema.json",
    "id": "049-amenity-services-24h-reception",
    "slug": "24h_reception",
    "description": {
        "es": "Recepción 24h",
        "en": "Recepción 24h",
        "pt": "Recepción 24h"
    },
    "applicableVerticals": ["accommodation"],
    "type": "SERVICES",
    "icon": "Reception24hIcon",
    "isBuiltin": false,
    "isFeatured": true,
    "displayWeight": 50
}
