{
    "$schema": "../../schemas/amenity.schema.json",
    "id": "059-amenity-outdoors-beach-chairs-umbrellas",
    "slug": "beach_chairs_umbrellas",
    "description": {
        "es": "Reposeras y sombrillas",
        "en": "Reposeras y sombrillas",
        "pt": "Reposeras y sombrillas"
    },
    "applicableVerticals": ["accommodation"],
    "type": "OUTDOORS",
    "icon": "BeachEquipmentIcon",
    "isBuiltin": false,
    "isFeatured": false,
    "displayWeight": 30
}
