{
    "$schema": "../../schemas/amenity.schema.json",
    "id": "005-amenity-kitchen-refrigerator-freezer",
    "slug": "refrigerator_freezer",
    "description": {
        "es": "Heladera con freezer",
        "en": "Heladera con freezer",
        "pt": "Heladera con freezer"
    },
    "applicableVerticals": ["accommodation"],
    "type": "KITCHEN",
    "icon": "RefrigeratorIcon",
    "isBuiltin": false,
    "isFeatured": true,
    "displayWeight": 50
}
